arcequine-microcurrent-device,"{'id': 1590095052909, 'title': 'ArcEquine Microcurrent Device', 'handle': 'arcequine-microcurrent-device', 'description': '<p><strong><span><span><span>ArcEquine Complete Kit</span></span></span></strong></p>\n<p>How to use the Arc Equine unit:</p>\n<p><iframe width=""560"" height=""315"" src=""https://www.youtube.com/embed/PR9lYUMKP1E"" frameborder=""0"" allow=""accelerometer; autoplay; encrypted-media; gyroscope; picture-in-picture"" allowfullscreen=""""></iframe> <!-- split --></p>\n<p><span><span><span>ArcEquine is a compact, portable, battery operated device, which delivers drug free, non-invasive Microcurrent Therapy. The ArcEquine Complete Kit contains everything you need to get started.</span></span></span></p>\n<p><span><span><span>The ArcEquine mimics the body\'s natural biocurrents to boost the production of ATP within cells. ATP is the energy component of the cells and introducing a microcurrent from an external source into the body can increase ATP production by up to 500%, kick-starting and accelerating the body\'s own recovery; allowing for the reduction of pain and inflammation, and for healing to start earlier.</span></span></span></p>\n<p><span><span><span>The ArcEquine Complete Kit includes: 1 x Leg Strap, 1 x Delivery Unit, 2 x Carbon Rubber Pads, 1 x Conductive Gel (250ml), 1 x Charger, 1 x User Manual.</span></span></span></p>\n', 'published_at': '2019-03-26T05:46:06+11:00', 'created_at': '2019-03-26T05:46:07+11:00', 'vendor': 'AmacronEquine', 'type': '', 'tags': ['ArcEquine Pain Management', 'Slider', 'Therapy'], 'price': 88500, 'price_min': 88500, 'price_max': 88500, 'available': True, 'price_varies': False, 'compare_at_price': None, 'compare_at_price_min': 0, 'compare_at_price_max': 0, 'compare_at_price_varies': False, 'variants': [{'id': 15192841060461, 'title': 'Default Title', 'option1': 'Default Title', 'option2': None, 'option3': None, 'sku': '', 'requires_shipping': True, 'taxable': True, 'featured_image': None, 'available': True, 'name': 'ArcEquine Microcurrent Device', 'public_title': None, 'options': ['Default Title'], 'price': 88500, 'weight': 1000, 'compare_at_price': None, 'inventory_management': None, 'barcode': ''}], 'images': ['//cdn.shopify.com/s/files/1/0027/8508/3501/products/3fb6b1_7e388f293952415791b0d61e80cf20e7_mv2_d_2400_2400_s_4_2.jpg?v=1553539567'], 'featured_image': '//cdn.shopify.com/s/files/1/0027/8508/3501/products/3fb6b1_7e388f293952415791b0d61e80cf20e7_mv2_d_2400_2400_s_4_2.jpg?v=1553539567', 'options': [{'name': 'Title', 'position': 1, 'values': ['Default Title']}], 'url': '/products/arcequine-microcurrent-device', 'media': [{'alt': None, 'id': 1556689354861, 'position': 1, 'preview_image': {'aspect_ratio': 1.0, 'height': 2400, 'width': 2400, 'src': 'https://cdn.shopify.com/s/files/1/0027/8508/3501/products/3fb6b1_7e388f293952415791b0d61e80cf20e7_mv2_d_2400_2400_s_4_2.jpg?v=1569208066'}, 'aspect_ratio': 1.0, 'height': 2400, 'media_type': 'image', 'src': 'https://cdn.shopify.com/s/files/1/0027/8508/3501/products/3fb6b1_7e388f293952415791b0d61e80cf20e7_mv2_d_2400_2400_s_4_2.jpg?v=1569208066', 'width': 2400}]}"
flexineb-e2,"{'id': 1590095118445, 'title': 'FLEXINEB E2', 'handle': 'flexineb-e2', 'description': '<p>The Flexineb E2 regular system is a portable, silent equine nebuliser for delivering aerosolised drugs and natural therapies to the airways of the horse. It operates from a rechargeable battery and has a unique flexible mask interface with a clear aerosol chamber and medication cup.\xa0 The soft flexible mask fits over the horses face and creates a good seal by tightening the strap around the horses head. A good seal is important to maximise inhalation of nebulised drugs and natural therapies.</p>\n<p>\xa0</p>\n<p>Complete system including grooming box, accessory kit, instruction manual with drug table, 0.9% saline and distilled water.</p>\n<p>\xa0</p>\n<p>Further Information</p>\n<p>Refer to information under Flexineb E2 Medication Cup</p>', 'published_at': '2019-03-26T05:46:08+11:00', 'created_at': '2019-03-26T05:46:09+11:00', 'vendor': 'AmacronEquine', 'type': '', 'tags': ['Flexineb Nebuliser', 'Stable & Yard'], 'price': 132600, 'price_min': 132600, 'price_max': 132600, 'available': True, 'price_varies': False, 'compare_at_price': None, 'compare_at_price_min': 0, 'compare_at_price_max': 0, 'compare_at_price_varies': False, 'variants': [{'id': 15192841125997, 'title': 'Default Title', 'option1': 'Default Title', 'option2': None, 'option3': None, 'sku': 'A001', 'requires_shipping': True, 'taxable': True, 'featured_image': None, 'available': True, 'name': 'FLEXINEB E2', 'public_title': None, 'options': ['Default Title'], 'price': 132600, 'weight': 0, 'compare_at_price': None, 'inventory_management': None, 'barcode': ''}], 'images': ['//cdn.shopify.com/s/files/1/0027/8508/3501/products/3fb6b1_f163447546a441ac89ddb7196273fc8b_mv2.jpg?v=1553539569'], 'featured_image': '//cdn.shopify.com/s/files/1/0027/8508/3501/products/3fb6b1_f163447546a441ac89ddb7196273fc8b_mv2.jpg?v=1553539569', 'options': [{'name': 'Title', 'position': 1, 'values': ['Default Title']}], 'url': '/products/flexineb-e2', 'media': [{'alt': None, 'id': 1556689584237, 'position': 1, 'preview_image': {'aspect_ratio': 0.909, 'height': 298, 'width': 271, 'src': 'https://cdn.shopify.com/s/files/1/0027/8508/3501/products/3fb6b1_f163447546a441ac89ddb7196273fc8b_mv2.jpg?v=1569208066'}, 'aspect_ratio': 0.909, 'height': 298, 'media_type': 'image', 'src': 'https://cdn.shopify.com/s/files/1/0027/8508/3501/products/3fb6b1_f163447546a441ac89ddb7196273fc8b_mv2.jpg?v=1569208066', 'width': 271}]}"
4-pack-energene-q10,"{'id': 1590095249517, 'title': '4 Pack Energene-Q10', 'handle': '4-pack-energene-q10', 'description': '<p><a href=""https://cdn.shopify.com/s/files/1/0027/8508/3501/files/Plusvital_Energene-Q10_Info.pdf?627"" target=""_blank"" rel=""noopener noreferrer"">Download Full pdf Brochure</a></p>\n<p>This 4 pack (3Kg) makes 120 doses. $5 per dose.</p>\n<p>Buy the Bulk 4 pack and save! Each 750g tub lasts 1 horse for 1 month.</p>\n<p>\xa0</p>\n<p><strong>ENERGENE-Q10</strong>\xa0is the world’s first nutrigenomic supplement for horses based on published scientific evidence, linking the nutritional requirements of the horse to its genetic make-up.</p>\n<p>\xa0</p>\n<p><strong>ENERGENE-Q10</strong>\xa0has been scientifically formulated to contain a highly bioavailable form of the mitochondrial Co-enzyme Q10 (CoQ10) to support more efficient energy production within a horse’s muscles. The formulation also contains anti-oxidant properties to aid in delaying fatigue and enhancing recovery following intense exercise.</p>\n<p>\xa0</p>\n<p><strong>CoQ10</strong>\xa0is a key nutrient for generating energy</p>\n<p>\xa0</p>\n<p><strong>EnerGene-Q10</strong>\xa0contains the nutrient Co-enzyme Q10 (CoQ10), which is critical for the production of cellular energy in the form of ATP. CoQ10 is used when energy is generated aerobically, a process that requires oxygen and is a much more efficient pathway than when energy is produced anaerobically, a process that does not require oxygen.</p>\n<p>\xa0</p>\n<p>Therefore, any deficiency in CoQ10 may result in a transition to the less efficient anaerobic energy generation cycle. CoQ10 is also a strong anti-oxidant.</p>\n<p>\xa0</p>\n<p>Field trials have shown that EnerGene-Q10 delivers CoQ10 to the muscle</p>\n<p>\xa0</p>\n<p>A key question in oral supplementation is whether the nutrient reaches the target region in sufficient quantities. In a field trial involving 19 Thoroughbred horses at a leading trainer’s yard in Ireland, daily supplementation of EnerGene-Q10 increased the level of CoQ10 in the muscle (P &lt; 0.01). After nine weeks of supplementation the CoQ10 concentration in the muscle increased by 40%.</p>\n<p>\xa0</p>\n<p><strong>Ingredients:</strong></p>\n<p>\xa0</p>\n<table>\n<tbody>\n<tr>\n<td>\n<p>\xa0</p>\n</td>\n<td>\n<p>\xa0</p>\n</td>\n<td>\n<p>per 25 g</p>\n</td>\n<td>\n<p>per kg</p>\n</td>\n</tr>\n<tr>\n<td>\n<p>Vitamins</p>\n</td>\n<td>\n<p>Vitamin E</p>\n</td>\n<td>\n<p>1,000 mg</p>\n</td>\n<td>\n<p>40,000 mg</p>\n</td>\n</tr>\n<tr>\n<td>\n<p>\xa0</p>\n</td>\n<td>\n<p>Vitamin C</p>\n</td>\n<td>\n<p>250 mg</p>\n</td>\n<td>\n<p>10,000 mg</p>\n</td>\n</tr>\n<tr>\n<td>\n<p>Trace Elements</p>\n</td>\n<td>\n<p>Selenium - SE Organic</p>\n</td>\n<td>\n<p>1 mg</p>\n</td>\n<td>\n<p>40 mg</p>\n</td>\n</tr>\n<tr>\n<td>\n<p>Other Additives</p>\n</td>\n<td>\n<p>Curcuma Longa</p>\n</td>\n<td>\n<p>200 mg</p>\n</td>\n<td>\n<p>8,000 mg</p>\n</td>\n</tr>\n<tr>\n<td>\n<p>Other Ingredients</p>\n</td>\n<td>\n<p>MicroActive® Co-enzyme Q10</p>\n</td>\n<td>\n<p>200 mg</p>\n</td>\n<td>\n<p>8,000 mg</p>\n</td>\n</tr>\n<tr>\n<td>\n<p>\xa0</p>\n</td>\n<td>\n<p>Ribose</p>\n</td>\n<td>\n<p>500 mg</p>\n</td>\n<td>\n<p>20,000 mg</p>\n</td>\n</tr>\n</tbody>\n</table>\n<p>\xa0</p>\n<p><span>Directions for use:</span></p>\n<p>Add 25g per day to feed. A 25g measure is provided.</p>\n<p>Each 750g contains 30 doses at 25g per day.</p>\n<p>\xa0</p>', 'published_at': '2019-03-26T05:46:10+11:00', 'created_at': '2019-03-26T05:46:10+11:00', 'vendor': 'AmacronEquine', 'type': '', 'tags': ['Energy', 'Specials'], 'price': 67600, 'price_min': 67600, 'price_max': 67600, 'available': True, 'price_varies': False, 'compare_at_price': 73600, 'compare_at_price_min': 73600, 'compare_at_price_max': 73600, 'compare_at_price_varies': False, 'variants': [{'id': 15192841224301, 'title': 'Default Title', 'option1': 'Default Title', 'option2': None, 'option3': None, 'sku': '', 'requires_shipping': True, 'taxable': True, 'featured_image': None, 'available': True, 'name': '4 Pack Energene-Q10', 'public_title': None, 'options': ['Default Title'], 'price': 67600, 'weight': 3000, 'compare_at_price': 73600, 'inventory_management': None, 'barcode': ''}], 'images': ['//cdn.shopify.com/s/files/1/0027/8508/3501/products/3fb6b1_9fefc9b134694722a70003b99e45c9bb_mv2.png?v=1553539571'], 'featured_image': '//cdn.shopify.com/s/files/1/0027/8508/3501/products/3fb6b1_9fefc9b134694722a70003b99e45c9bb_mv2.png?v=1553539571', 'options': [{'name': 'Title', 'position': 1, 'values': ['Default Title']}], 'url': '/products/4-pack-energene-q10', 'media': [{'alt': None, 'id': 1556689977453, 'position': 1, 'preview_image': {'aspect_ratio': 0.996, 'height': 556, 'width': 554, 'src': 'https://cdn.shopify.com/s/files/1/0027/8508/3501/products/3fb6b1_9fefc9b134694722a70003b99e45c9bb_mv2.png?v=1569208066'}, 'aspect_ratio': 0.996, 'height': 556, 'media_type': 'image', 'src': 'https://cdn.shopify.com/s/files/1/0027/8508/3501/products/3fb6b1_9fefc9b134694722a70003b99e45c9bb_mv2.png?v=1569208066', 'width': 554}]}"
poly-belt-kit-900mm-high,"{'id': 1590095544429, 'title': 'Poly Belt 2mm Thick', 'handle': 'poly-belt-kit-900mm-high', 'description': '<h2><strong>Polybelt Kit for Horse Round Yards</strong></h2>\n<p><strong>POLY BELT®\xa0is the ideal product for sheeting stockyard panels and arenas.\xa0 It limits the chances of stock bruising while also acting as a visual barrier.<br><span></span><span><br></span>POLY BELT</strong><span>®\xa0does not degrade from\xa0</span><span>UV\xa0rays or any other environmental factors. It is resistant to chemicals, mould, mildew and fungus.\xa0</span><br><br><strong>POLY BELT</strong><span>®\xa0can be easily fixed to timber or steel yards by screws (a washer is recommended), zip ties, wire or any other way you want.\xa0 It is extremely tough but also very flexible, allowing it to turn right angle corners or curve to fit a trough.</span><br><br><strong>POLY BELT</strong><span>®\xa0is lightweight and therefore will not sag gates or any other yard structures when fixed.</span><br><br><strong>POLY BELT</strong><span>®\xa0is the best solution to prevent vigorous root systems from\xa0entering septic systems, concrete and paved areas.\xa0</span></p>', 'published_at': '2019-03-26T05:46:18+11:00', 'created_at': '2019-03-26T05:46:19+11:00', 'vendor': 'AmacronEquine', 'type': '', 'tags': ['Stable & Yard'], 'price': 55000, 'price_min': 55000, 'price_max': 101000, 'available': True, 'price_varies': True, 'compare_at_price': None, 'compare_at_price_min': 0, 'compare_at_price_max': 0, 'compare_at_price_varies': False, 'variants': [{'id': 15192845189229, 'title': '600mm / 50m', 'option1': '600mm', 'option2': '50m', 'option3': None, 'sku': 'PBHRYK-1', 'requires_shipping': True, 'taxable': True, 'featured_image': None, 'available': True, 'name': 'Poly Belt 2mm Thick - 600mm / 50m', 'public_title': '600mm / 50m', 'options': ['600mm', '50m'], 'price': 55000, 'weight': 60000, 'compare_at_price': None, 'inventory_management': None, 'barcode': ''}, {'id': 15528769421421, 'title': '600mm / 105m', 'option1': '600mm', 'option2': '105m', 'option3': None, 'sku': 'PBHRYK-2', 'requires_shipping': True, 'taxable': True, 'featured_image': None, 'available': True, 'name': 'Poly Belt 2mm Thick - 600mm / 105m', 'public_title': '600mm / 105m', 'options': ['600mm', '105m'], 'price': 101000, 'weight': 126000, 'compare_at_price': None, 'inventory_management': None, 'barcode': ''}, {'id': 15528769454189, 'title': '900mm / 50m', 'option1': '900mm', 'option2': '50m', 'option3': None, 'sku': 'PBHRYK-3', 'requires_shipping': True, 'taxable': True, 'featured_image': None, 'available': True, 'name': 'Poly Belt 2mm Thick - 900mm / 50m', 'public_title': '900mm / 50m', 'options': ['900mm', '50m'], 'price': 101000, 'weight': 90000, 'compare_at_price': None, 'inventory_management': None, 'barcode': ''}, {'id': 15528769486957, 'title': '900mm / 105m', 'option1': '900mm', 'option2': '105m', 'option3': None, 'sku': 'PBHRYK-4', 'requires_shipping': True, 'taxable': True, 'featured_image': None, 'available': True, 'name': 'Poly Belt 2mm Thick - 900mm / 105m', 'public_title': '900mm / 105m', 'options': ['900mm', '105m'], 'price': 101000, 'weight': 189000, 'compare_at_price': None, 'inventory_management': None, 'barcode': ''}, {'id': 15528769519725, 'title': '1200mm / 50m', 'option1': '1200mm', 'option2': '50m', 'option3': None, 'sku': 'PBHRYK-5', 'requires_shipping': True, 'taxable': True, 'featured_image': None, 'available': True, 'name': 'Poly Belt 2mm Thick - 1200mm / 50m', 'public_title': '1200mm / 50m', 'options': ['1200mm', '50m'], 'price': 101000, 'weight': 120000, 'compare_at_price': None, 'inventory_management': None, 'barcode': ''}, {'id': 15528769552493, 'title': '1200mm / 105m', 'option1': '1200mm', 'option2': '105m', 'option3': None, 'sku': 'PBHRYK-6', 'requires_shipping': True, 'taxable': True, 'featured_image': None, 'available': True, 'name': 'Poly Belt 2mm Thick - 1200mm / 105m', 'public_title': '1200mm / 105m', 'options': ['1200mm', '105m'], 'price': 101000, 'weight': 252000, 'compare_at_price': None, 'inventory_management': None, 'barcode': ''}], 'images': ['//cdn.shopify.com/s/files/1/0027/8508/3501/products/3fb6b1_fff6d49c89b54085a11b37c7e2b06b84_mv2.jpg?v=1553539579'], 'featured_image': '//cdn.shopify.com/s/files/1/0027/8508/3501/products/3fb6b1_fff6d49c89b54085a11b37c7e2b06b84_mv2.jpg?v=1553539579', 'options': [{'name': 'Width', 'position': 1, 'values': ['600mm', '900mm', '1200mm']}, {'name': 'Length', 'position': 2, 'values': ['50m', '105m']}], 'url': '/products/poly-belt-kit-900mm-high', 'media': [{'alt': None, 'id': 1556690468973, 'position': 1, 'preview_image': {'aspect_ratio': 1.333, 'height': 375, 'width': 500, 'src': 'https://cdn.shopify.com/s/files/1/0027/8508/3501/products/3fb6b1_fff6d49c89b54085a11b37c7e2b06b84_mv2.jpg?v=1569208066'}, 'aspect_ratio': 1.333, 'height': 375, 'media_type': 'image', 'src': 'https://cdn.shopify.com/s/files/1/0027/8508/3501/products/3fb6b1_fff6d49c89b54085a11b37c7e2b06b84_mv2.jpg?v=1569208066', 'width': 500}]}"
carton-of-6-500ml-vetericyn,"{'id': 1590097248365, 'title': 'Carton of 6 - 500ml Vetericyn', 'handle': 'carton-of-6-500ml-vetericyn', 'description': '<p><strong>Carton of 6 x 500ml Vetericyn Plus</strong></p>\n<p>\xa0</p>\n<p>One-step topical spray for minor wounds. The steroid-free antibiotic-free, no-rinse solution is based on hypochlorous acid, an oxy-chlorine compound similar to that produced by the animals own immune system. Vetericyn will not harm healthy tissue and because it is ph balanced, it will not sting when applied. tests free for competitive animals.\xa0<br><br>For cleansing and protecting wounds, cuts, irritations and scratches. In solution, this product is antibacterial and antifungal. Safe to use around the mouth and nose.</p>\n<p><span>SHIPPING INFO</span></p>\n<p>All products in stock - if ordered before 1pm will be despatched same day.</p>', 'published_at': '2019-03-26T05:46:51+11:00', 'created_at': '2019-03-26T05:46:51+11:00', 'vendor': 'AmacronEquine', 'type': '', 'tags': ['Horse Supplements'], 'price': 13259, 'price_min': 13259, 'price_max': 13259, 'available': True, 'price_varies': False, 'compare_at_price': None, 'compare_at_price_min': 0, 'compare_at_price_max': 0, 'compare_at_price_varies': False, 'variants': [{'id': 15192853512301, 'title': 'Default Title', 'option1': 'Default Title', 'option2': None, 'option3': None, 'sku': 'V500Carton', 'requires_shipping': True, 'taxable': True, 'featured_image': None, 'available': True, 'name': 'Carton of 6 - 500ml Vetericyn', 'public_title': None, 'options': ['Default Title'], 'price': 13259, 'weight': 3000, 'compare_at_price': None, 'inventory_management': None, 'barcode': ''}], 'images': ['//cdn.shopify.com/s/files/1/0027/8508/3501/products/8403d6_a325f82530c04811beea895687141eff_mv2.png?v=1553539612'], 'featured_image': '//cdn.shopify.com/s/files/1/0027/8508/3501/products/8403d6_a325f82530c04811beea895687141eff_mv2.png?v=1553539612', 'options': [{'name': 'Title', 'position': 1, 'values': ['Default Title']}], 'url': '/products/carton-of-6-500ml-vetericyn', 'media': [{'alt': None, 'id': 1556693155949, 'position': 1, 'preview_image': {'aspect_ratio': 1.0, 'height': 250, 'width': 250, 'src': 'https://cdn.shopify.com/s/files/1/0027/8508/3501/products/8403d6_a325f82530c04811beea895687141eff_mv2.png?v=1569208066'}, 'aspect_ratio': 1.0, 'height': 250, 'media_type': 'image', 'src': 'https://cdn.shopify.com/s/files/1/0027/8508/3501/products/8403d6_a325f82530c04811beea895687141eff_mv2.png?v=1569208066', 'width': 250}]}"
vetericyn-alushield-combo,"{'id': 1590095151213, 'title': 'Vetericyn & Alushield Combo', 'handle': 'vetericyn-alushield-combo', 'description': 'AFTERPAY ACCEPTED<p>Choose Offline Payment option at Checkout to pay via Afterpay</p>\n<p>Vetericyn 500ml and Alushield Bandage</p><p>\xa0</p><p><a href=""https://youtu.be/6IzBTAol0ig"" target=""_blank"">Watch Video explanation</a></p>', 'published_at': '2019-03-26T05:46:09+11:00', 'created_at': '2019-03-26T05:46:09+11:00', 'vendor': 'AmacronEquine', 'type': '', 'tags': ['Slider', 'Veterinary', 'Wound Care', 'Wound Dressing'], 'price': 7500, 'price_min': 7500, 'price_max': 7500, 'available': False, 'price_varies': False, 'compare_at_price': None, 'compare_at_price_min': 0, 'compare_at_price_max': 0, 'compare_at_price_varies': False, 'variants': [{'id': 15192841158765, 'title': 'Default Title', 'option1': 'Default Title', 'option2': None, 'option3': None, 'sku': '', 'requires_shipping': True, 'taxable': True, 'featured_image': None, 'available': False, 'name': 'Vetericyn & Alushield Combo', 'public_title': None, 'options': ['Default Title'], 'price': 7500, 'weight': 0, 'compare_at_price': None, 'inventory_management': 'shopify', 'barcode': ''}], 'images': ['//cdn.shopify.com/s/files/1/0027/8508/3501/products/3fb6b1_375bfb4a23ac4c33bc8e43acbab0a1ca_mv2.png?v=1553539570'], 'featured_image': '//cdn.shopify.com/s/files/1/0027/8508/3501/products/3fb6b1_375bfb4a23ac4c33bc8e43acbab0a1ca_mv2.png?v=1553539570', 'options': [{'name': 'Title', 'position': 1, 'values': ['Default Title']}], 'url': '/products/vetericyn-alushield-combo', 'media': [{'alt': None, 'id': 1556689617005, 'position': 1, 'preview_image': {'aspect_ratio': 1.0, 'height': 600, 'width': 600, 'src': 'https://cdn.shopify.com/s/files/1/0027/8508/3501/products/3fb6b1_375bfb4a23ac4c33bc8e43acbab0a1ca_mv2.png?v=1569208066'}, 'aspect_ratio': 1.0, 'height': 600, 'media_type': 'image', 'src': 'https://cdn.shopify.com/s/files/1/0027/8508/3501/products/3fb6b1_375bfb4a23ac4c33bc8e43acbab0a1ca_mv2.png?v=1569208066', 'width': 600}]}"
equiclear-200l,"{'id': 1590097051757, 'title': 'EQUICLEAR 200L', 'handle': 'equiclear-200l', 'description': '<p><strong><span><span><span><span><span><span>Long Lasting, Environmentally Safe Dust Control 200 Litre</span></span></span></span></span></span></strong></p><p>\xa0</p><p>By suppressing dust, you are significantly reducing the incidence of rattles.\xa0Not only would it help the health of the foals and consequently their growth/development it would also reduce the very high cost of treatment. This is not only the cost of the drugs, but also about the cost of stabling, staff, time, air con boxes etc plus the detrimental effects the current treatment has on the foal.</p><p>\xa0</p><p><span><span><span><span><span><span>EQUICLEAR™ is an environmentally safe dust suppressant that eliminates the need to water, does not dry out and is ideal for day yards and high traffic areas. Clear and odourless EQUICLEAR is highly refined, and proven to be non-toxic to humans, animals, marine life and plants. EQUICLEAR comes ready to use (no water or mixing required). Perfect for applications on dusty areas, such as day yards, sand rolls, arenas, unpaved roads, gravel parking lots.</span></span></span></span></span></span></p><p>\xa0</p><p><u><span><span><span><span><span><span>EQUICLEAR - How it Works</span></span></span></span></span></span></u></p><p><span><span><span><span><span><span>Most dust suppression treatments just coat the dust particles. EQUICLEAR works differently. EQUICLEAR soaks into the individual soil/dust particles making them too heavy to move thus eliminating dust. It does not form a crust and never evaporates thereby being unaffected by traffic. Because it never evaporates it lasts a very long time, often 9-12 months or more of dust control with one application. Plus, when it’s time to re-apply it is done at a much lower rate insuring cost effective long lasting dust control.</span></span></span></span></span></span></p><p>\xa0</p><p><u><span><span><span><span><span><span>Application:</span></span></span></span></span></span></u></p><p><span><span><span><span><span><span>EQUICLEAR is easy to apply, simply spray onto soil, the application rate depends upon the soil type, but a suggested starting point is 1 Litre per square meter.</span></span></span></span></span></span></p>', 'published_at': '2019-03-26T05:46:47+11:00', 'created_at': '2019-03-26T05:46:48+11:00', 'vendor': 'AmacronEquine', 'type': '', 'tags': ['EQUICLEAR'], 'price': 243000, 'price_min': 243000, 'price_max': 243000, 'available': True, 'price_varies': False, 'compare_at_price': None, 'compare_at_price_min': 0, 'compare_at_price_max': 0, 'compare_at_price_varies': False, 'variants': [{'id': 15192853348461, 'title': 'Default Title', 'option1': 'Default Title', 'option2': None, 'option3': None, 'sku': '', 'requires_shipping': True, 'taxable': True, 'featured_image': None, 'available': True, 'name': 'EQUICLEAR 200L', 'public_title': None, 'options': ['Default Title'], 'price': 243000, 'weight': 200000, 'compare_at_price': None, 'inventory_management': None, 'barcode': ''}], 'images': ['//cdn.shopify.com/s/files/1/0027/8508/3501/products/3fb6b1_4c6990b867c54f64b82ff271eb5504fe_mv2.png?v=1553539608'], 'featured_image': '//cdn.shopify.com/s/files/1/0027/8508/3501/products/3fb6b1_4c6990b867c54f64b82ff271eb5504fe_mv2.png?v=1553539608', 'options': [{'name': 'Title', 'position': 1, 'values': ['Default Title']}], 'url': '/products/equiclear-200l', 'media': [{'alt': None, 'id': 1556692598893, 'position': 1, 'preview_image': {'aspect_ratio': 1.0, 'height': 600, 'width': 600, 'src': 'https://cdn.shopify.com/s/files/1/0027/8508/3501/products/3fb6b1_4c6990b867c54f64b82ff271eb5504fe_mv2.png?v=1569208066'}, 'aspect_ratio': 1.0, 'height': 600, 'media_type': 'image', 'src': 'https://cdn.shopify.com/s/files/1/0027/8508/3501/products/3fb6b1_4c6990b867c54f64b82ff271eb5504fe_mv2.png?v=1569208066', 'width': 600}]}"
